title,adult,original_language,overview,tagline,genres,production_country,year
The Accidental Hooker,1,5,"Every hooker has a secret. Silvia is about to reveal hers. Former college student turned high-class call girl, Silvia lets us in on the intimate details of her life, as a documentary film crew interviews her for a piece of ""Escorts"". Private jets, world class hotels, and unthinkable sex acts have given her an amazing tale to tell. But the best is yet to come ... and as her sordid story comes to a close, a terrifying truth is revealed ... on that may mean the end for the unsuspecting film crew. So beware ... for some secrets are best left untold.",['Some Things Are Better Left Unsaid'],['Drama'],70,2008
Super Hornio Brothers,1,5,"A power surge sends whacked out computer programmer Squeegie Hornio and his brother Ornio into cyberspace where they meet up with, have sex with, and even fight, a variety of characters from a popular video game.","[""This Ain't No Game""]","['Comedy', 'Fantasy']",70,1993
The Sensually Liberated Female,1,5,"Documentary on female sexuality and the sexual habits of women. Among the subjects covered herein are fellatio, sunbathing, sodomy, bubble baths, belly dancing, masturbation, and various pelvic exercises a woman can do to increase sexual stimulation.",['Everything you wanted to know but were AFRAID to ask!'],['Documentary'],70,1970
Naporneon Dynamite,1,5,A XXX parody of the film 'Napoleon Dynamite'.,"['Naporneon Dynamite', "" I'm pretty much a flippin' stud""]","['Adventure', 'Comedy']",70,2010
Suddenly On Sale! A Female SOD Employee The Technology Department A First-Year Staffer A Camera Assistant We Filmed Sara Koike Having Virginal Private Sex!,1,14,"Sara Koike, a new employee who joined the engineering department of SOD to become a cameraman. A female employee who has a well-organized face and a very cute smile, and has a good reputation in the company, but she is a hard worker who works hard toward her dreams. The male employees who planned to make her appear in AV stayed close to her for a long time. An urgent release of an innocent shy SEX video that succeeded in shooting with that hand!","['This Sporty Tomboyish Girl Wants To Be A Cameraman', 'But In Reality She’s Really Naive And Innocent And Gets Her Pussy Wet Really Easily And Loves To Engage In Masutrbation Every Day At Home?']",['Documentary'],40,2018
Centurians of Rome,1,5,"Roman countrymen are sold into slavery for not paying their taxes during Caligula's reign as Emperor. Orgies take place and include: a guard being rimmed by a slave who is being sucked by another, shooting into faces, mutual masturbation, and more. Other encounters also include spanking and butt-fucking, chains and sweat.","[""Caligula's empire ... Ruled by Passion! Destroyed by Lust!""]",['Drama'],70,1981
My Private Tutor,1,5,As a college tutor Jesse Jane has put her porno past behind her. But when student Erik Everhard finds out about Jesse's former X-rated adventures he and his buddy Bill Bailey want to sample the hardcore moves that made her a sex symbol. Roommate Manuel Ferrara thinks he has his blue movie techniques down and schools exchange student Abigaile Johnson in the ways of pleasures. When porn starlet Brooklyn Lee comes to town she flips the script on Manuel and shows him how to properly do some dirty fucking. On the side Erik talks his girlfriend Pressley Carter into making some camera phone porn. Jesse teaches the guys how to please a woman in this incredibly erotic movie!,['The things she teaches the boys are a scandal'],['Comedy'],70,2012
Flawless,1,5,"Everyone wants a taste of the good life... In particular, Duchess lusts for a better life for her daughter and herself, and she has her eye on the prize - a jeweler and his private collection. But, so do the circle of thieves around her - the two-timing private pilot, the tattooed girlfriend, the grifter and the ex-con all want a piece of something Flawless.","[""You'll do anything when you want the best for your daughter...""]",['Drama'],70,2018
A Dream of Body,1,5,"This is the story of Ted, a dreamer whose secret desires come to life as he encounters a variety of men and escapes into elaborate sexual fantasies.",['Fantasies do come true!'],['Fantasy'],70,1972
The Maddams Family,1,5,"The Maddams family face a financial crisis, so Horticia concocts a plan to turn their family mansion into a whorehouse.",['Adding new blood...to the oldest profession.'],"['Comedy', 'Horror']",70,1991
Kayden's Frisky Business,1,5,"When hot, horny coed Kayden learns her scholarship money is being cut off by the greedy dean of students, she invites her friends over to raise money the old fashioned way: sex. Kayden and her dick loving girlfriends get the money flowing as they suck, straddle and stroke cock after cock to earn the big bucks for school.","[""It's a frisky business"", ""but somebody's gotta do it!""]",['Comedy'],70,2009
Ball Busters,1,5,Six sex tales told by a cop. Two dirty cops blackmail a punk rock chick into a threesome. Two girls have fun with each other. Two girls have fun with a guy. He seduces another girl. The cop has a fling. A phone sex operator gets a call.,['Eight beautiful young women who know what they want... and get it!'],['Comedy'],70,1985
Silk Stockings: The Black Widow,1,5,"Derek, a drifter who takes a job as a bartender at a hot night spot, and who thinks with his dick rather than his head, gets drawn into a murderous insurance scheme.","[""Expose yourself to the delightful pleasures of seeing a woman's legs in silk stockings!""]",['Drama'],70,1995
Blonde Goddess,1,5,"The erotic, macho dreams of Elmo Smathers, shy comic book artist, transport him first to a lush South American forest, where he meets a tribe of lusty warriors, and ultimately their beautiful pagan queen, The Blonde Goddess.  Next, Elmo's fantasies take him to France during WW1 where he defeats the Black Baron in a thrilling sky duel. Both men live to share the insatiable ladies of the Chateau. The Blonde Goddess appears, as she does at the climax of each fantasy, luring him to place of endless lust.  Jack Hammer, Private Eye, is Elmo's next reverie. Hammer's current case involves intimate associations with the sexy sirens of the 1940's.  Thrusting into the future, Elmo battles the galactic overlord, Megazon, for the safety of the universe and the flesh of the five succulent otherworldly beauties.",['...An Erotic Climax To The 20th Century'],"['War', 'Drama', 'Science Fiction', 'Adventure']",44,1982
Crossroads,1,5,"One in the military. One a mechanic. They reunite after a long absence and discover their friendship might have been more. Unfortunately, their plans didn't allow for it. Director Jim Steel, with erotic superstars Danny Summers and Chuck Barron looks deep into the male psyche and comes up with one of the most stirring videos of the year, Crossroads, A time to choose paths.","['When you find yourself there', 'find yourself.']","['Romance', 'Drama']",70,1994
Taboo 21,1,5,"There's gonna be a hot time in the old town tonight!  It's summer in Mississippi during the Roaring Twenties and temperatures are running hot. Take a young black man seeking revenge, mix with a crooked sheriff, country girls feeling the heat of sexual desire, and a passel of local good ol' boys who don't stand for any ""mixin' of the races"", and you've got a sure fire recipe for disaster.",['Undeniably The Most Explicit And Shocking Tale Of Taboo Sex Ever Told On Film!'],"['Drama', 'Romance']",70,2005
Enemies with Benefits,1,5,"19-year-old Jamie just wants someone to love. With no one to call his own he just decides to put an end to it all. That is until a visitor from beyond shows Jamie that his life has meaning and that he needs to stay alive and fulfill his destiny. But the visitors motives may not be all for the good in this over the top throwback to the casual sex, clothes optional adult comedy.","['A Triple Threat', 'a Double Crosser', 'a Trouble Maker from Beyond. With friends like these... Not your typical boy meets boy story!']",['Comedy'],70,2016
Reel People,1,5,A quasi-amateur porn movie starring several regular people who answered the filmmakers' sex ad to participate in a professional porno shoot where they'd get to have sex with some famous porn stars on camera for the film.,"['Real People Like You', 'Your Friends & Neighbors Or Co-Workers... Performing Their Sexual Fantasies On Film For The Very First Time!']",['Documentary'],70,1984
House of De Sade,1,5,A group of friends decide to spend the night at a creepy old rundown house. They hold a seance that unleashes the evil spirit of De Sade. All kinds of debauched carnal activities immediately follow thereafter.,"['A seance in a Haunted House', 'Bondage', 'S&M', 'flagellation and a very lucky cucumber']",['Horror'],70,1977
Island Fever 2,1,5,"Volume Two of a collection of shorts featuring the three top models/porn stars, Tera Patrick, Devon, and Stormy in various stages of undress and sex on location on the black sand beaches of Hawaii.",['Return To Paradise'],"['Fantasy', 'Romance']",70,2003
Terror Camp,1,5,"In June of 2017, a group of college students hike out to the Los Padres Forest, hoping to find evidence of a local urban legend. After the first night, their professor is missing. Aidra believes her classmate Cecilia is playing with her, and trying to sabotage her research. But weird noises are heard at night and more people are going missing. Aidra with the help of her friend Charlotte decide to investigate, leaving camp, they delving further into the woods . . . they're never seen again. A few years have passed now, and this is their story, pieced together by their recovered video camera and cellphone footage. This is what they discovered.",['Some Secrets Are Better Left Buried'],"['Romance', 'Horror', 'Thriller']",8,2019
Island Fever,1,5,"Immerse yourself in an island sanctuary, where all your senses are stimulated by unending, relentless passion. Relax and let the island goddesses, Tera Patrick, Briana Banks and Julia Ann, nurture your spirit, among other things. You'll realize it's not the tropical sun that's making you sweat...it's Island Fever! And there is no cure.",['Paradise is Relative… Heaven is Absolute'],"['Fantasy', 'Romance']",70,2001
Spirit of Seventy Sex,1,5,"A tongue-in-cheek look at the sex lives of the Founding Fathers, including George Washington, Benjamin Franklin, and Captain John Smith.",['A History of the Sexual Revolution'],['Comedy'],70,1976
The Con Job,1,5,"Sexy Kayden Kross is a bad girl in need of some hot, horny fun with her nasty, stiff membered partner, James Deen. He's a twisted, perverted con man running his lusty game against everyone, including Kayden, until she turns the naughty tables on him. Wild sex games, and hard pumping action makes the hot babes, Riley Steele, Giselle and Nikki Delano, jump on the dangerous ride with deep drillers and hung studs, Erik Everhard, Manuel Ferrara and Charles Dera.",['Dirty little liars'],['Crime'],70,2012
Waiting on Love,1,5,"As “good girl“ Ally's romance ends badly, she has no interest in starting a new one. Her best friend/roommate however, has no such concerns, as she eyes a hot, new neighbor - Mason. Mason isn’t interested because he’s holding out hope that he’ll reconcile with his estranged wife. Over time, a friendship develops between Ally and Mason and although they are afraid to admit they have fallen for each other … it happens! Just when it seems things may work out, the love Mason has been waiting for returns. Emotions are raw as fate, destiny and love determine what happens next!","['Fate', 'destiny and love wait for no one.']",['Romance'],70,2014
Hacked,1,5,"Hacked is a drama about cyber bullying and its effects. After Stoya learns that Kayden will be getting a promotion over her, she befriends Mr. Pete by giving herself to him in order to use him to hack into Kayden's social media accounts, phone, emails, and destroy her reputation. Day after day all of her friends and coworkers received sexual content and propositions from Kayden set up by her menace Stoya, who is out to get her at any cost. Even after having sex with her boss Giovanni Francesco on the factory floor, Kayden couldn't keep her job. What will she do next in order to get her life back?",['The Cyber Penetration'],['Drama'],70,2013
Spread,1,5,"When the bank threatening to foreclose, operating a food truck wasn't the best solution for Kayden Kross, unless you're serving the 'special'. Adrianna Luna helps turn Kayden's luck around by putting her delicious self on the lunch menu. When Kayden tries, it gets her a night in the slammer. When she is offered a 'get out of jail free card' by officer Bill Bailey, Kayden loses her chance to Christy Mack & Yurizan Beltran, who fuck their way to freedom. Her only solution now, sell her food truck to Evan Stone and duck him and the bank manager James Deen, to financial independence.",['Lunch is served!'],['Drama'],70,2013
Counselor Week at Camp Liberty,1,5,"Welcome to Camp Liberty! When newbie camp counselor Andrew, meets camp leader Jack, during orientation, Andrew finds he has more than campfires and weenie roasts on his mind! When Andrew’s attempt to gain Jack's affection fails, he devises a plan that threatens not only a would be summer fling, but Jack himself!",['These BOYS take CAMP to a whole new level!'],"['Comedy', 'Romance']",70,2014
Cherry 2,1,5,"Cherry's passions begin to unravel as she hires more sexy and willing dancers to entertain the premium level members of her lesbian strip club. The more popular her club becomes the deeper Cherry's obsessions twist, seeing her lost soulmate, Talia, in every lusty corner of her mind. As she loses control of reality, her emotions dictate her powers of persuasion, especially as the innocent love of her girlfriend, Harlow, holds her soul captive. Avery and Katherine enjoy the fruits of the new dancers, while DJ Carson explores salacious sex after a tantalizing seduction from a beautiful club member.",['Many passions rule her world. But one girl rules her heart.'],"['Romance', 'Drama']",70,2011
Arnold the Fornicator,1,5,"Hasta la Vista, Baby! Call me the Sperminator while I get some tasty pussy from my wife, the maid, and even a few other hotties!","[""My wife's pussy never looked this good!""]",['Comedy'],70,2011
Swingers Retreat,1,5,"Before beautiful Jesse Jane and her fiancé Chad White are to be married, they put their relationship through the final test, a swingers resort! The second they step out of the car, the couple is greeted by swinging pros Keiran Lee and Capri Cavanni who show them around the resort and teach them the ins and outs of swinging. Around every corner is a new erotic surprise for the adventurous couple.",['Check in for a good time...'],['Comedy'],70,2013
Home Wrecker 4,1,5,"Hot and sexy BiBi Jones shows off her naughty, youthful ways by taking on two boys in her first b/b/g/ threesome ever! Erik Everhard and Nacho Vidal continue their search for the perfect nympho roommate who will suck and pump and still pay her fair share of the rent without getting in between them and their nasty ladies, Melanie Rios and Lea Lexis. Vicki Chase gets back with ex-hung lover, Nacho, but the romance might burn itself out when the next slutty babe tries to rent a room with these hard horny dudes.",['Living with her has benefits!'],"['Romance', 'Comedy']",70,2012
Faithless,1,5,"Meet Kelli McCarty... a true, genuine, former Miss U.S.A., and star of the NBC soap opera Passions. But you can only spend so long pleasing your public, the networks, your lovers and other judges. Then it's time to please yourself. And does she ever. Presenting Faithless, the controversial, ground-breaking drama from adult's most awarded director Paul Thomas... in which Kelli shocks every world she's ever been in, from network television to national beauty pageants... and rocks your world all at the same time. Beyond beautiful, beyond hot, beyond belief. Kelli McCarty is the faithless wife Callie, who cheats on her husband with her stepdaughter's boyfriend. But Callie isn't the only one who is faithless.","[""She's Loyal...To Many Men""]","['Drama', 'Romance']",70,2009
Home Wrecker 3,1,5,"The bad boys, Erik Everhard and Nacho Vidal, are back, on the horny hunt for naughty, new girlfriends and hopefully, a sexy roommate. Beautiful Jesse Jane slides in as the lead candidate to fill their lusty needs with her dripping desire. Gorgeous Riley Steele, Charley Chase and Holly Michaels are game for wild times with hard member dudes, but hung stud Manuel Ferrara proves that his house is loaded with loose screws in need of a good hammering!","[""She's Got Your Tool In Hand!""]","['Comedy', 'Romance']",70,2012
Caught!,1,5,"Caught! delivers laughs and hardcore sex galore, as a beautiful P.I. and her sexy assistant go undercover (and under covers) to get the dirt on cheating spouses! No cheating man - or woman - is safe, as the dynamic dick and dike-loving pair go to great lengths to catch their cheater!","[""If you're caught"", ""you're f*cked!""]",['Comedy'],70,2014
The Pornographer,1,5,"It’s 1964, and monsters, robots and aliens are not selling movie tickets anymore. Hollywood needs women, the more scantily clad, the better. So what’s a young, naive, socially awkward director to do?","['WARNING ""The Pornographer"" is a Motion Picture for Adults ONLY!']",['Comedy'],70,2014
Skip Trace 2,1,5,"As a pair of beautiful bail bondswomen working for Tommy Gunn, the bad-ass blondes work hard and fuck harder. When an old acquaintance (Keiran Lee) needs help on a case the girls sex up, suit up and are ready to take down bad guy, Nacho Vidal.","['You jump bail', 'they jump your bones!']",['Action'],70,2012
Oh! My Sex Goddess,1,14,"Kousuke is an everyday nice-guy college kid who suffers from a reoccurring nightmare where he's a rampaging sex demon. He just can't figure out why that is, as he sits down to play his favorite video games like Magical Girl Lape-chan. One day a beautiful Goddess named Fauna appears before him, not to grant wishes, but to destroy him! It seems Kousuke has the power of an evil demon sleeping inside of him. Luckily, Fauna decides on an alternate means of stopping the demon, which involves lots of sex with her and sexy older sister (and love potion maker) Jordh. Unluckily, there's Natsuki, a little devil with plans of her own for Kousuke.",['Based on an adult game by Front Wing'],"['Animation', 'Romance']",40,2007
Devon: Stripped,1,5,Her dreams led her to L.A. Her friend led her to a place she thought she would never go. She found the only way to gain anything is to lose everything.,['They Know Your Weakness'],['Drama'],70,2002
24 XXX: An Axel Braun Parody,1,5,"He's back...and he's gonna need a hacksaw! Legendary director and 24 mega-fan Axel Braun delivers porn parody gold with this hilariously sexy spoof featuring uber bad-ass Jack Bauer on the longest, funniest day of his life. Think you can't laugh your ass off, be hugely entertained, and get totally turned on at the same time? You don't know Jack!","[""Jack is back... Damm't!""]","['Action', 'Comedy']",70,2014
Entourage: A XXX Parody,1,5,"From New Sensations, the studio that brought you The Office: A XXX Parody & 30 Rock: A XXX Parody, comes the story of a group of friends that are living the life: getting rich, getting famous, & getting laid. Follow parodies of your favorite characters (Eric, Vince, Turtle, and Drama) on their sex-filled adventures through the hottest pussy in La La Land & all the fun things that cum with it! When Vince's latest film flops, Turtle decides to upload a celebrity sex tape of Vince and everyone's favorite super-starlet-next-door, Mandy Moorehead. Will it revive his blockbuster Hollywood career, or will it lead to a Big role in Aquaman: A XXX Parody?",['You will want to hug one out when you watch ENTOURAGE – A XXX PARODY!'],['Comedy'],70,2009
Star Babe,1,5,The Star Angels are sent to the planet Phallus to prevent a takeover of Earth.,['The sky is the limit!'],['Science Fiction'],70,1977
Wingmen,1,5,"Rising star, Xander Corvus and his buddies’ are living it up in Hollywood! His acting career is booming and he’s taking his friends along for the ride. Having caught the eye of hotties like a movie executive’s daughter, Mia Malkova and porn star, Chanel Preston, he’s getting laid in every direction. His brother, Ike Diezel, on the other hand is struggling as a B-List actor. Longtime friend and manager, Bill Bailey, attempts to manage Xander’s career but pussy keeps getting in the way and his other friend, Dane Cross, is happy to just tag along for the wild ride. Xander’s latest movie obsession is with an El Campo script and if he doesn’t get it, he’s threatening to quit the industry. His friends and agent, Keiran Lee, are going to have to rally together and help Xander get this movie or else their lifestyle and careers are at risk!",['Brothers from another mother'],['Drama'],70,2014
Babe,1,5,"Babe, heiress to a massive fortune and top fashion model can't control her insatiable sexual appetite. Top stylist Cappuccini can't keep his hands to himself and soon sparks are flying between him and Babe. Cappuccini's wife learns about his dirty secret and plots to disgrace the heiress and bring scandal to the fashion world.",['Starring Viva Style as an insatiable heiress who is about to get busted!'],['Drama'],62,2007
Oriental Baby Sitter,1,5,"A beautiful young Asian girl, trying to earn some extra money, takes on jobs as a babysitter. The job introduces her to a whole new world of sexual experiences, and she discovers that she actually likes them.","['The Fun Starts After ""The Kids"" Are in Bed']",['Drama'],70,1977
Nothin' But Trouble,1,5,"Returning home from a nightmarish blind date, Felicia (Stormy Daniels) walks in on her kinky free-spirited roommate, Alice (Asa Akira) as she's engaged in her own ""date"". Felicia lets them have their fun and goes to a local dive bar for a much needed cocktail. She meets a charming, sexy bartender and although he's younger and not her type, sparks - and clothes - fly.This innocent one-night stand, however, turns into a crazy evening of guns, drugs, kidnapping and a surprise love connection.","[""It's gonna be a long"", 'hard night...']","['Crime', 'Comedy']",70,2014
Devil's Ecstasy,1,5,"A young college student gets word that her mother has died, so she returns to her family estate to claim her inheritance. She winds up getting involved in witchcraft, satanism, and lots of sex.",['The Devil made them do it - and they loved it!'],['Horror'],70,1976
Devil's Due,1,5,A young girl fleeing an abusive home life arrives in New York City and becomes involved in a Satanic cult. She conspires with the cult leader's two lesbian assistants to take over the coven.,['Who said the Devil was a man?'],['Horror'],70,1973
Big Breast Nurses 4,1,5,"Sascha is in a coma. Nurse Tory offers to help relieve the patient and maybe pull him out of the coma. Nurse Ava discovers that Dane is a virgin. She knows just the procedure to see if his cock is working alright before he has sex for the first time! Dr. Johnson is undecided on who will be his new assistant. After a long decision process, Nurse Jessica takes matters and his cock into her own hands. Nurse Banxxx is new to the hospital. Unsure about a certain procedure, she convinces the Doctor to let her practice with his cock! Nurse Bella is caught in a real sticky situation. Lucky for her, Doctor Jack knows just what to do!","['Diagnosis: Coma', 'Permanent Erection!']",['Comedy'],8,2010
Eden,1,5,"There is a remote island, not found on any map, a place so unique that few have ever ventured there and from which even fewer have returned. It is a place of seductively dangerous beauty, shrouded in mystery and virtually untouched by the world me know.  Filmed in beautiful Hawaii and loaded with breath-taking beaches and scenery, Eden’s packed with high-energy action and genuine passion you won’t find in other adult movies.",['Leave your worries (and inhibitions) behind for this exotic island filled with passionate sex and forbidden fantasies!'],['Adventure'],70,2007
Sadie,1,5,A contemporary film based on the 1921 story by Somerset Maugham.  A high priced call girl in Borneo is kidnapped by the rajah who is running a white-slave ring.,['Now a powerful film'],['Drama'],70,1980
The Boudoir of Elodie,1,8,"Elodie leaves her husband Laurent when she discovers he has a mistress. She gets drunk in a bar and shares a bottle with a wino in the street. they have sex over the top of some trash cans. She then goes to her sister's place and interrupts her in bed with her boyfriend, Christophe. They go off to stay with their father in the country. He has a very obliging maid, Hélène, and a shy young man, Guillaume, is staying with him. Guillaume becomes infatuated with Elodie.","[""A woman sorts out her marital problems at her father's house in the country.""]","['Drama', 'Romance']",18,1983
Skip Trace,1,5,"Jesse Jane and Riley Steele star as bounty hunters working for Tommy Gunn on a mission to find their man or woman... by any means necessary! Using all the womanly weapons at their disposal, these lusty ladies use their bodies to get what they want, and what they want is their bounty.","[""They'll do anything to get their man.""]",['Action'],70,2012
Doctor Penetration,1,5,"Sweet Stacey Donovan and Herschel Savage star as a pair of newlyweds whose car breaks down on their way to their honeymoon in this steamy sexvid. When they knock on the door of the nearest house, the couple enters a wanton world of unleashed sexuality and debauchery that they'll definitely never forget.","[""He Put the 'X' in Examination""]","['Comedy', 'Horror', 'Science Fiction']",70,1986
