title,adult,original_language,overview,tagline,genres,production_country,year
Arina In A Totally Nude Shocking Transfer The Interview Special Arina Hashimoto,1,14,"Arina Hashimoto transferred exclusively to FALENO star! In order to know everything about the arena, a thorough ""interview"" was held. From my favorite things to my favorite play, even my erogenous zone weaknesses that I accidentally talked about... I've said it all myself, so I'm going to pass through here, and based on that information, I'll be squid! From good situations to sexual desires, the first work packed with all of Arina-chan!","[""Hashimoto Arina FALENO star exclusive transfer! She's going to perform while interviewing"", ""and she'll say everything from her favorite things to sex desires! Don't miss it!""]",['Drama'],40,2020
Inferno,1,5,"When things get too hot to go outside, what's a girl to do? Find out when former supernymph Teri Weigel ignites the screen with Ashley Nicole, Alicyn Sterling and April Rayne. Directed by F.J. Lincoln and Patti Rhodes.","[""It's Teri's First Time Ever!""]",['Drama'],70,1991
Reign of Tera 2,1,5,"In the second installment of the decadent Reign of Tera series, Tera Patrick gets back in action with her first ever boy-boy-girl scene. We find her back at the Asian Love Palace, Mr. Jonez's high roller Asian whorehouse, where every imaginable fantasy is fulfilled. However, sex, jealousy, drama, and even murder leave everyone in this lust filled XXX thriller wanting more...",['Return To The Asian Love Palace'],['Drama'],70,2007
Taboo 17,1,5,"Join the sultry Misty Rain as she continues to push the envelope in the raunchy Taboo tradition. It's number seventeen and Misty plays a cat burglar with a bag full of tricks: plastic wrap, blindfolds, ropes, rubber, cuffs, and ponytails.","[""Misty's Coming...  She's After Your Jewels!""]",['Drama'],70,1998
Interracial Family Affairs 3,1,5,Ava Sanchez: Mom had to go out of the country on business and sent me to stay with my Uncle Jay. He was always nice to me. Needless to say I got comfortable right away. So comfortable I started having sexual dreams about my Uncle... Jenna Foxx: Mom suggested I go spend some time at Uncle Jays to get away from my troubles and Uncle Jay was happy to take me in. Ocean Pearl: After hearing so much about Uncle Jay from my aunt I had to spend some time with him over the summer. He was just as nice as everyone said but I could tell there was more to him.,['3 Teenage Ebony Beauties. One Naughty Uncle. Guess What Happens.'],['Drama'],70,2015
TS Babysitters,1,5,"Sex crazed TS teens Chelsea Poe and Aspen Brooks babysit for pocket money - and to seduce all the sex-deprived new moms and dads. But when Chelsea's tryst with muscular dad Jaxton Wheeler destroys his marriage, the sexy redhead finds herself falling for his devastated, voluptuous wife (Susie Q). Meanwhile, beautiful brunette Aspen zeroes in on flustered single dad Ty Roderick until she meets his gorgeous brother Vadim Black.",['The best babysitters play with Mommy and Daddy too'],['Romance'],8,2016
Feed Me,1,5,"Sally, an ordinary woman, finds herself consumed by an otherworldly presence, leading to an eerie transformation and insatiable hunger. With the help of Dr. Petit, Sister Dorothy, and her best friend Heather, Sally embarks on a treacherous journey to regain control over her existence and feed the monster before it devours her.","['Her lust unleashed', 'a nightmare unfolds']",['Horror'],8,2023
An Evening With Kitten,1,5,Fantasize to your Heart's Content as you watch the Incredible Kitten Natividad Frolic in this Hilarious Burlesque Extravaganza.,['Truly a Video of Mammoth Proportions'],['Comedy'],70,1983
Fixxxion 2,1,5,"It's a magical mix of fantasy, fairytales and deliciously horny porn. Fixxxion is the most original porn brand of recent years and this 2nd part also shows what is so special about this delicious label.",['A Fantasy Tale of Sin'],['Drama'],62,2022
Not a Romance,1,5,"On the outside her life looks nearly perfect, but this trophy wife wants out of her glass cage. Sex on the side is liberating and she can't get enough. But how long can they continue in their affair without it turning into something more?","['When a Kiss Is Just a Kiss', 'And Sex Is Just Sex', 'This Affair is...']","['Romance', 'Drama']",70,2003
Starlet Nights,1,5,"Beautiful, but wicked stepmother Joyce White aspires to be the fairest woman of them all in Hollywood, California. When she discovers that her sweet virginal stepdaughter Snow White has usurped her status, Joyce concocts a plan to ruin Snow's reputation as a pure and innocent lass.",['How Far Does A Girl Have To Go To Make It!'],['Comedy'],70,1982
Prison Heat,1,5,"After murdering her husband, Linda (Carter Cruise), is sent to prison. She's placed in a cell with Hope (Ana Foxxx) an older inmate. With the help of Hope, Linda feels more secure, especially at night when Eleanor (Sinn Sage), the heartless warden, does her night rounds. On top of it, she has to deal with the prison bully Elvira (Alison Ray) and Bette (Serene Siren), the prison doctor who exchanges sexual favors for protection. Can you expect anything else from the criminal system? The heat rises when all the girls end up together at night, with the exception that in prison no one can hear you moan.",['In Prison No One Can Hear You Moan'],['Romance'],8,2019
All About Ashlynn,1,5,"Boy, have we got a treat for you. It's our contract star, Ashlynn Brooke, getting wild & rowdy in five hot new scenes! Watch her bounce on Tommy Gunn's one-eyed cleaver, then get pounded by Mark Wood in the beaver. After that, watch her get it just the way she likes it from Ramon Nomar, Jordan Ash, and Marco Banderas. She's just a simple southern girl that loves to show her skills, so she'll do whatever it takes to pay the bills!",['5 Hot New Scenes with Ashlynn Brooke'],['Romance'],70,2008
Unfinished Business,1,5,"Joel is away at university just getting ready for midterms when he gets a surprise visit from his old partner in crime, Lana. This of course can mean nothing but trouble for Joel. Before you can say ""I just failed Algebra,"" Lana and Joel are back in business, and the news is spreading fast. The whole campus wants what Joel is selling, and are willing to pay for it, big time. Lana and her girls are more than happy to give the student body a taste of their ""private tutoring"" sessions.","['Sometimes you just gotta say', 'WTF? (Want To Fuck?)']",['Comedy'],70,2011
Tropic of Eros,1,5,"A spellbinding tale of an eternal beauty, a deserted Hawaiian island, and tall mysterious stranger with whom only she can communicate.","[""Shot on Location In Jenteal's Pants...""]",['Fantasy'],70,1998
Sabotage,1,5,"A tale of sexual treachery, betrayal, perversion, and lust.",['Deceit. Scandal. Betrayal.   She loved it.'],"['Drama', 'Mystery']",70,1994
Debbie for President,1,5,"Alicia Monet stars as Debbie, a television reporter assigned to cover the upcoming election from a woman's perspective.",['She put the vice in the presidency.'],['Comedy'],70,1988
Anal Brat,1,5,"Enjoy this rear entry romp with Julianne James as she tries to get her boyfriend (Tony Montana) help with his problem. He is obsessed with a TV program called ""Anal Brat"". Watch these erotic encounters as the chicks get down and dirty.",['The Brat is back for a rendezvous in the rear!'],['Comedy'],70,1993
Deliciously Tight,1,2,"Four scenes of some of the hottest twinks working in European porn.  Scene 1; Nico Vegas and Jon Biscuit are tourists and are learning new songs. After Jon has learned enough, Nico decides to support him with his cock.  Scene 2; Sam Bayard (from French Twinks) meets up with Joel Tamir and gets to enjoy every inch of Joel's massive cock.  Scene 3;  Burning candles to get in the right mood is always sweet, soon Ollie Barn and Samuel Bayker get to explore each other's bodies.  Scene 4; Nico Vegas cheated on Tristan Webber, now he tries to make up for that. Tristan thinks orgasms are better than break-ups, so he forgives Nico after a lovely flipflop.","[""Who doesn't like a tight twink body? We know a few boys that love showing off!""]","['Drama', 'Romance']",11,2023
Britney Pierce: Oops!... I Fucked Him Again,1,5,"Oops, Britney Pierce has fucked and sucked her way into yet another filthy fuckfest! Don't let her pretty smile and spunky spirit fool you, she is one hell of a dirty diva! Watch as this pop ""shot"" star as she has some sexy fun in five steamy scenes including a hot threesome where Britney easily handles two horny guys.","['Pop ""Shot"" Star']",['Comedy'],70,2010
The Awakening,1,5,"Paul Thomas has created a modern masterpiece with The Awakening, inspired by the true story of a 1970s adult film star who turned to new age religion to calm her sexual discontent before eventually committing suicide. Emotionally stunning, this psychological story of sexual healing ranks with Thomas` best work, like The Masseuse, Bad Wives, Justine and Bobby Sox. Inari Vachs delivers a stunning performance as the sexually confused starlet, as does Kobe Tai as her ex-junkie singer friend. Both deserve pre-noms for Best Actress. Equally good is Bobby Vitale, with a career-best performance as the link between the two girls that easily earns him a Best Actor pre-nom, as well.",['Paul Thomas Creates a Story of Sexual Redemption.'],"['Drama', 'Romance']",70,1999
Simply Kia,1,5,A mermaid Kia at an island resort saves Peter North. But alas this is not your typical story.,['77'],['Fantasy'],70,1995
Behind Blue Eyes 3,1,5,"How blue can you be? Director Scotty Fox pushes the limits of erotica to new boundaries in Behind Blue Eyes #3 to find out. Set in the Italian restaurant, you'll see dishes on the menu you won't find at any other eating establishment. When the cuisine is served, the patrons lick a lot more than just fingers. Hungry yet? See Behind Blue Eyes #3. Betcha can't watch it just once!",['Take Extreme Pleasure and multiply it by ten'],"['Fantasy', 'Drama']",70,1990
Pleasure Highway,1,5,Shot entirely on location on the backroads along historic route 66- a traveling writer and his voyeuristic girlfriend search for the secret locations where stunning- hot and bothered travelers devour their men in heated sexual passions. When the road gets hot- these wayward travelers quench their sexual energies in lost- forgotten places where anything goes and usually does. Our writer and his tintialatting young guest get more than they bargained for when they find a cowgirl pleasuring her man at a forgotten shack- two hitchhikers do eachother in an abandoned pool in the middle of the desert- two gorgeous women enjoy eachother in a watering tubm a couple quench their thirst at a rest stop- asizzling girl demands rear entry from her boy toy ... and more.,"[""You never know what's around the Corner""]","['Fantasy', 'Thriller']",70,2000
Foolproof,1,5,"Trust is a funny thing. It seems like you always end up giving it to the people most likely take advantage of it. That's why private investigators stay so busy. When you get right down to it, people just don't trust each other. They can't. Because everyone has their price. For Ed Travis, private investigator, it two hundred bucks a day, plus expenses... And the occasional broken heart.",['A Picture is Worth a Thousand Lies.'],"['Drama', 'Romance']",70,1994
Flesh,1,5,"Special agent Eric Shank, a lethal world-class assassin, lies wounded in foreboding surroundings meant to stimulate his ""recovery."" Enter sexual terrorist Nipples the Clown--and exit everything you ever thought you knew about pornography.",['13 Wet Nymphos Stripped Bare and Pumped Raw...Taste the Sins of Their Flesh.'],['Mystery'],70,1996
Smile Guide,1,5,Nicolas finds a VHS tape in a box that his ex-girlfriend left behind. What he watches next will determine her fate... or maybe even his.,['A Video Guide for Your Sanity'],['Horror'],70,2023
KTSX 69,1,5,Expect sexual pandemonium when amorous Amanda mounts the microphone at the raunchiest radio station to ever sizzle the airwaves...KTSX-69!,['All Sex Radio... All the Time.'],['Comedy'],70,1988
"Your Breasts, Your Choice!",1,5,"Karlee Grey is in total ecstasy. She receives a long and sensual massage from Lacy Lennon. Like any good massage, there will be a very nice happy ending. Lena Paul arrives for her massage appointment, complaining about her back. The masseuse, Evelyn Claire, is secretly attracted to Lena's large breasts. The sensual massage turns to sex, with passionate kisses, and Lena rubbing her breasts against Evelyn's pussy. Detective Abella Danger received a call regarding a lack of money at a massage parlor. When she goes to the reception and starts moving stuff, Haley Reed walks into the room and asks her what she's doing. When Haley finds out why Abella was coming, Haley changes her tone from aggressive to pleasant because she can't let Abella know SHE is the thief she's hunting down. Haley offers to take a little break so that Abella can enjoy a massage in order to distract her from the investigation.","['Your Breasts', 'Your Choice!']","['Crime', 'Romance']",8,2022
Smoke Screen,1,5,"Everyone hides behind a SMOKE SCREEN at some point in his or her life. For Michael, that time is now. A successful rock manager, he's carrying on a torrid affair with Angie, a dazzling rock star. In this provocative look at modern marriage and morality, you'll get a glimpse of how the other half lusts. The forgotten wife with her lesbian needs the swinging playboy who'll sleep with any slut, and the conniving singer who satisfies her insatiable desires at all costs! It's passion and adultery in the fast track showbiz world...but it's no different from anywhere else!","[""It's Passion in the Fast Track Showbiz World!""]","['Drama', 'Romance']",70,1990
West Side,1,5,Modern day adult movie take on Romeo & Juliet.,"[""Love Isn't Always in Black & White""]","['Drama', 'Romance', 'Crime']",70,2000
Cockraiser,1,5,"Sexy college student Kirsty can’t stand her horrible and horny new stepmother, Julia. So Kirsty summons and seduces the evil demon Semenite, Penishead to get rid of her father's rebound wife, but not before Julia takes the slimy, talking, dismembered Hell-Penis of her ex-lover for one last ride.","[""He'll tear your hole apart.""]","['Comedy', 'Horror']",70,2017
Beautiful Evil,1,5,"A story of dark desires, forbidden pleasures and the carnal hunger of pure sin. From the night she appeared the sultry, dark and beautiful Stephanie lays waste to her willing victims from a taunting, teasing wet tongue to the most exquisite of anal ecstasies to frenzied orgies of decadence she captures men and women on her web and uses them in her wicked game of lust Until they're of no use at all If it looks to good to be true..it is.",['The Mistake Every Man Wants To Make.'],['Fantasy'],70,1998
Realities,1,5,Ashlyn Gere indulges in her her innermost fantasies.,['When Fantasies are Not Enough.'],['Fantasy'],70,1991
Chemical Reaction,1,5,Chemical Reaction,['A story of passion... bottled up.'],"['Fantasy', 'Romance']",70,1995
Whack Job,1,5,"Comedic genius and award winning writer/director Stormy Daniels brings you the story of Adrianna Di'Angelo. This spoiled mafia princess has just discovered her boyfriend Darren in bed with another woman. What's the daughter of a mobster to do? Get even, of course! When daddy refuses to put a hit out on the cheating boyfriend, Adrianna takes matters into her own hands and convinces two hit men to take the job. Unfortunately for everyone involved, these goons are bumbling idiots and manage to hilariously screw up every attempt at whacking Darren. In a strange turn of events, the unsuspecting Darren doesn't end up ""sleeping with the fishes""...instead he ends up actually rescuing the men sent to kill him, meaning the only real whack job in this story is head case Adrianna!","[""What's the daughter of a mobster to do? Get even"", 'of course!']","['Comedy', 'Crime']",70,2009
Shayla's Swim Party,1,5,Shayla's having a pool party and porn stuff happens.,['Have You Practiced the Breast Stroke Lately?'],['Comedy'],70,1996
What Girls Like,1,5,"What Girls Like gives you a front-row seat as we explore the sex lives of 7 very different women. As sexual ideals are uncovered, you may be surprised when traditional romance blossoms or when a no-nonsense business woman is exposed as a whore at heart. You'll love each and every one! And as a special treat, newest Wicked Pictures contract girl Alektra Blue and Mikayla will unveil their secrets... and in the process you may just find out What Girls Like!","[""You'll love each and every one!""]",['Comedy'],70,2008
zoom,1,5,when two friends decide to do a challange it goes horribly wrong,['when your meeting became a nightmare'],"['Horror', 'Thriller']",31,2023
Fantasex Island,1,5,"Visit Fantasex Island, where guests have their most secret sexual fantasies fulfilled with lustful pleasure.",['Visit the most Erotic Island Paradise in the World!'],['Comedy'],70,1983
On Your Honor,1,5,"An upstanding judge gives a petty thief on parole a break, and what follows is definitely not by the books.",['These Legal Lovers Do It on the Books!'],['Comedy'],70,1989
Breeders,1,5,"Procreation or Execution: The Race is on The year is 2012 and the world is in devastation. Only twelve survive with the fertile genes to repopulate the planet, the Breeders. It's a carnal struggle for survival as a band of merciless criminals, the Population, try to hunt down and eliminate the twelve before breeding can occur.",['Gina LaMarca in a world gone mad...'],['Science Fiction'],70,1996
Wedding Bell Blues,1,5,"On her wedding day, young Tabitha is starting to have doubts about marrying her sweetheart Kevin. Although she loves him dearly, her mind wonders if she's sacrificing future fantasies in favor of a ball and chain. With only moments before she's to tie the knot, her family and friends rush to her side to calm her fears and share their own hilarious stories of cold feet, warm hearts, and wild sex. As Tabitha comes to her senses, she realizes that getting married is not the end of her life, but the start of a wonderful adventure with Kevin. .","['Something Old', ""Something New. Something Borrowed... Someone's Blue.""]","['Romance', 'Comedy']",70,2008
Thick 'n Creamy,1,8,"Seven of the hottest models perform for the camera in the first half of this production. In the second half, ten young men attend a country school where sex seem to be the only thing on the curriculum.","[""16 Hard Men In 90 Minutes of Creamin' Action!""]",['Fantasy'],18,1985
Blazing Bedrooms,1,5,"Steven is a kind-hearted, smart boy. But his existence has a catch: he is married to two tight-assed, firm-breasted, beguilingly blonde women. Both of them are named Debbie, and when the scam is discovered, they want to tear each other to pieces. And Steven's best friend Jerry, who only wanted to settle the dispute, suddenly sees himself between the horny opponents as an erect third.- A fast-paced game of confusion, in which the deceived cheater Steven finally only his car remains: until Debbie No.3 opens the floodgates for him...","[""It's double trouble being married with two wives...""]",['Comedy'],70,1986
Hot Trash,1,5,A day in the (sexual) life at an apartment building. It begins when the maintenance man makes a routine check and finds the manager laying nude out in the sun.  The maintenance man makes further intriguing discoveries as the day progresses.,['The Dirtiest Boys on the Block!'],['Fantasy'],70,1981
Palace of Pleasures,1,5,"""Country Bumpkin"" Jeff Rodgers is walking along a country road when The Chief picks him up in a little red convertible. Jeff is told he has been ""under observation"" and invited to accompany The Chief. He is shown various sexual fantasies and after each one The Chief seduces Jeff a little further until they take part in the last fantasy in the hot tub.","[""There's Something For Everyone!""]",['Fantasy'],70,1981
Trisexual,1,5,"Nick is a sexual pioneer. He does what he wants. . .when he wants. He lets his body follow his imagination and his imagination has no limits! The ""Trisexual"" crosses all lines, shatters all taboos. Nothing is too bizarre. Travel with Nick. He will try anything once! He's the ""Trisexual""!","[""...He'll Try Anything...ONCE!""]",['Drama'],70,1983
"Like Mother, Like Daughter",1,4,"Things that we are taught in our childhood, we keep for the rest of our lives. This experience the attractive Barbara Taylor has to make. She had a child relatively early with her boyfriend William, who is now her husband. But William is not very loyal and gets punished for it: When fucking the horny neighbor, his heart stops, making Barbara single-handedly raise her child. Of course, she makes sure that her daughter doesn't suffer the same fate. Thus, she is of course furious when the daughter brings home the first boyfriend. But things take their course - like mother, like daughter.","['An immoral tale about love', 'sex and genetics']",['Romance'],23,1990
A Tasty Kind of Love,1,5,"This sex-comedy opens up with Krysta Lane accepting the award for her company’s advertising campaign for “Manly Condoms.” The story traces through her search and subsequent hiring of a copywriter (Jerry Butler), who gets more than he bargained for by the way this agency tests its’ product. Cara Lott sizzles as the ad spokesmodel, and the sexual scenarios through.",['Behind the doors of an amorous ad agency!'],['Comedy'],70,1987
The Bitch is Back,1,5,"The porn comeback of the year! Ingrid Swede is back. As usual, she stretches the limits, delivering a goopy ""lesbian shock"". In addition, some good, wet, oily sex with Nora Nord & Tina, plus some horny female teachers...","[""Sweden's foremost superslut is back!""]",['Drama'],64,2007
We Live Together 35,1,5,12 Luscious Girls!,['12 Luscious Girls!'],['Drama'],70,2014
Topless Stewardesses,1,5,"40DDs at 40,000 feet!","['40DDs at 40,000 feet!']",['Fantasy'],70,1994
Sweat 2,1,5,"John Leslie can't work up a sweat when he's having intercourse, and visits a psychiatrist who attempts to cure him.","['""Every Bead is Bliss""']",['Comedy'],70,1988
Born to Run: The Careena Collins Story,1,5,"Through the years, there have been many nubile nymphs and sensual beauties who have been called ""star"" in the adult film industry, but none of them have been a match for Careena Collins in terms of innocent beauty, physical versatility and sheer sexual delights. Now, you can see how a young princess from a middle-class family turns into a sizzling sexual screen siren. From her early days at home with a domineering father to her days as a down and out runaway living with a gang of bikers to her momentous first audition, you'll see Careena searching for, and finally finding a way to channel her intense libido.","[""The True Story of a Runaway's Erotic Journey into Womanhood""]",['Drama'],70,1986
Flight Sensations,1,5,Herschel Savage and Pat Manning host a collection of stories relating the erotic experiences of flight attendants.,"['""22"" of the top adult stars in one film']",['Fantasy'],70,1983
Inside Ursula,1,5,"Ursula is plagued with nightmares about being sexually assaulted. Instead of being sympathetic, her husband makes excuses while trying to continue their love life as if nothing was happening.  Ursula flees New York City for the Connecticut countryside, but that is only the beginning of the erotic adventures that follow.","['""Ursula"" - In Her Dreams She\'s A Sex Goddess; In Real Life She\'s Even Better!']","['Drama', 'Fantasy']",70,1975
Super Sluts of Wrestling,1,5,"Thousands of young and beautiful women try to make it in the glitz capital of the world. A crafty scientist thinks he has the answer for his voluptuously sexy girlfriend. A serum that will turn her into a super-powerful champion in the lucrative and attention-getting world of Oil Wrestling. Before he has a chance to inject her with his miracle fluid, another female wrestler steals it for herself. But instead of developing the physical prowess to win over all contenders, the serum turns her into a voracious, non-stop sexual animal! Then comes the big night where the scientist's girlfriend and the sex-crazed tigress clash for the championship. What a sight! Oil-soaked glistening bodies, tussling, clawing, pulling, biting, mauling, wrestling for the coveted prize. The crowd goes wild! Everybody's UP, bug-eyed, watching these two buxom, beautiful babes battling it out. The winner? See for yourself in the most scorching, sizzling climax ever filmed.",['A Sensational Exposé of the Oil-Soaked Hellcats of the Ring!'],['Comedy'],70,1986
Endless Love: A Greek Adventure,1,5,BelAmi returns to Greece in search of Endless Love. Join eleven boys on their summer Greek adventure.,['BelAmi Returns to Greece. Join 11 Boys On Their Summer Adventure.'],"['Drama', 'Romance']",12,2022
Deep Blue: A Greek Adventure,1,5,BelAmi returns to Greece with eight boys on vacation... on the prowl... ready to plunge into the Deep Blue.,['8 BelAmi Boys on Vacation... and on the Prowl!'],"['Drama', 'Romance']",12,2023
What Went Wrong,1,5,"She's (Stormy Daniels) too demanding and he's (Marcus London) too aloof. He's a slob, she's controlling. She works too much, he won't get a job. Time goes by... They both want out, finally something they can agree on! But at the end of every relationship there's that one awkward moment. That time when when you're forced to face each other, maybe at a restaurant, the dry cleaner or maybe the old apartment. And sometimes you ponder the obvious and tey to figure out exactly What Went Wrong ... and maybe, just maybe, you'll discover everything that went right.",['Sometimes you ponder the obvious and tey to figure out exactly What Went Wrong...'],"['Romance', 'Comedy']",70,2010
