title,adult,original_language,overview,tagline,genres,production_country,year
Double Risky Mosaic:  Rio and Yuma,1,14,"Super idol Yumachin and Rio are miraculous co-stars! Gorgeous gorgeous where two love juices mix violently! W Blow sucking on the cock and squirting at the same time while fainting in agony! Continuous Bakobako insertion, W acme & W rich facial cumshot with hard piston FUCK! Please fully enjoy this one blissful work that can monopolize two people! !!",['Super idol Yuma-chan teams up with the gorgeous RIO for the greatest team-up in AV history!'],['Documentary'],40,2008
Road Queen 33,1,5,"Deauxma is back in the 33rd installment of the fan favorite Road Queen series. Become transfixed as maturing stripper Deauxma continues her trek across the Southwest in her radical custom Ford, looking for a new life ? and a lot of new lovers! Hot lesbian sex is served up in this rural American motel.","[""She's Looking For A Few Good Women""]",['Romance'],70,2015
Budapest,1,5,Girls in Budapest having mind-blowing sapphic sex.,['Hungary For Lesbian Love'],['Romance'],70,2010
Lip Service,1,5,Have you ever wondered what horny MILFs do when there are no dicks in sight? Find out every pussy pleasing secret in the book from these experienced muff-diving mamas. Julia Ann and Raylene lead the cast of the hottest girl-on-girl action in XXX - they know exactly where to lick and what to suck to get each other off - and they want you to watch!,['All Girl All MILF'],['Romance'],70,2010
Jugsy,1,5,A topless dancer named Jiggles opens up a massage parlor and pays off the mayor with sex to keep her doors - all of them - wide open.,"[""Where there's smoke""]",['Crime'],70,1992
Mother-Daughter Exchange Club 12,1,5,Moms and their daughters mix with other romance minded mom-daughter pairs!!!,['Mother knows best!'],['Romance'],70,2010
TS Bad Girls,1,5,"The transition from girl to woman can be tough, and for these wayward TS beauties it's even more challenging. Enter Mz. Berlin, the unorthodox cis-Headmistress at a school for troubled teens. TS lesbian teen Chelsea Poe seduces blonde cis-cutie Suzie Spindrift, earning her some severe sexual discipline from Mistress Berlin. Troubled TS Tiffany Starr also gets a big dose of tough love from Berlin, while Chelsea's TS aunt Jaqueline eases the stress caused by her troubled niece with hot young lover Wolf Hudson.",['These troubled TS teens need constant stimulation'],['Romance'],8,2015
My Dad's TS Girlfriend,1,5,"Lonely, single dad David (David Chase) has finally found love again, and his adopted son (Wolf Hudson) is excited to meet his Dad's new fiance. But when the beautiful Sunday (Sunday Valentina) shows up to play Mommy, younger man Wolf can't deny his animal lust for the hot TS Cougar. Will sexy Wolf's lust for his Dad's TS girlfriend destroy the happy family to be? Or does David have an even bigger secret of his own?",['His hot new stepmother is no ordinary woman'],['Romance'],8,2015
Aubrey Kate's TS Fantasies,1,5,Beautiful blonde Aubrey Kate is every man's fantasy - but the hot TS beauty has some kinky fantasies of her own! Let Aubrey Kate take you on a wild ride as she explores all the many facets of her sexuality and the men she wants to dominate - and be dominated by.,['Your TS fantasy girl has some fantasies of her own'],['Romance'],8,2015
TS Stepmother,1,5,"Beautiful Savannah Thorne is engaged to muscular Daddy Nick Capra, but she can't curb her insatiable appetite for hot younger men. When she meets Nick's son, Vadim Black, sparks immediately fly between the handsome young stud and the elegant TS goddess. Meanwhile, Nick has some secret vices of his own, and sneaks away for afternoon sex with exotic beauty Natassia Dreams.",['His hot new stepmom is no ordinary woman.'],['Romance'],8,2016
Her First Older Woman 10,1,5,Lizz Tayler & Mellanie Monroe:  Lizz and Mellanie skip the picnic so they can eat in. Victoria Lawson & Zoey Holloway: Things are about to pick up for Victoria at this lame party... Proxy Paige & Torre Pines:  Proxy is dying to see what an older woman tastes like... Jennifer White & Roxanne Hall:  Roxanne is here to teach Jennifer what she can't learn in a book!,['Featuring Lizz Tayler & Mellanie Monroe'],['Romance'],70,2010
M.I.L.T.F. 31,1,5,"It's amazing to think that these sexy as hell, MILFs, have already given birth. It'd be easier to believe if their pussies weren't so tight!",['Featuring Sandy Beach'],['Romance'],70,2007
Lesbian Sex in Unusual Places,1,5,"Aubrey Addams & Austin Taylor: The L Factor is at sea! Aubrey and Austin are laying out on the deck... Ryzell & Eu'Nique Styles: Down below in the galley, Eu'Nique and Ryzell enjoy each other's cookies... Laurie Vargas & Jazmine Star tuck themselves away in a nook of the yacht... And up on the bow, Dia Zerva and Hayden Night make waves of their own!","['When you need sex', ""it doesn't matter where you are!""]",['Romance'],70,2009
Chubby Lesbians in Love,1,5,Missy Martinez & Samantha St. James: Missy and Samantha enjoy the view the only way they know how...  Wanda Lust & Slut Deb:  Wanda and Deb heat up the sauna...  Even Moore & Malaysia Ford:  Even and Malaysia can't keep their chubby hands off of each other... Jessica D'Vine & Brooke Scott: Brooke and Jessica have each other as an appetizer before dinner...,['Featuring Missy Martinez & Samantha St. James'],['Romance'],70,2009
Her First Lesbian Experience 2,1,5,It's that first sexual experience that they'll remember all their lives!,['Featuring Emy Reyes & Andrianna Angel'],['Romance'],70,2009
I Screwed My Stepsister's Girlfriend 2,1,5,"Scarlett Pain & Sonya Sage:  Scarlett's gonna get back at her stepsister for stealing her mp3 player. Missy Martinez & Aubrey Addams:  While her stepsister is out of town, Aubrey is going to get to know her girlfriend.  Alia Janine & Mellanie Monroe:  Alia just wants to take some artsy photos of her girlfriend's stepsister, Mellanie. They'll be tasteful. Seriously.  Danalea & Crissy Moon:  Danalea checks in with her girlfriend's stepsister, Crissy, before bed.","['It all started with a friendly kiss', ""but it felt so good we didn't want to stop!""]",['Romance'],70,2010
Her First Older Woman 9,1,5,Veronica and Kiera have an office crush on one another...and now they're ready to act on it! Kendra has a whole bunch of tricks in her bag… and she's ready to show Sonya a few! Ms. Attison needs to educate Chastity on proper work etiquette. Sammie needs some serious tutoring from Ms. Monroe...,['Featuring Kiera King & Veronica Rayne'],['Romance'],70,2010
Hot Cookies,1,5,Cult director Howard Ziehm directs Abigail Clayton as a high society chick who goes slumming for sleazy sex partners in her limousine.,['Starring Five Erotic Beauties From The Pages of Playboy & Penthouse'],"['Drama', 'Horror']",70,1977
The Birthday Party,1,5,The Birthday Party is a Quirky Black Comedy which stars James Kearney as a Convict who gets out of Jail for one day to celebrate his birthday and meet up with some decidedly crooked friends. What could possibly go wrong......?,['An Easy going Irish Gangster just wants to celebrate his birthday without killing anyone'],['Crime'],36,2002
I Screwed My Stepsister's Girlfriend,1,5,"When love, and a lot of lust is involved…  It doesn't matter what they call her!","['Featuring Allie', 'Ami & Marlene']",['Romance'],70,2009
She's My Man 6,1,5,There are very few things that will take Allie away from her video games. Brittany is one of those things...  Sammy has been waiting all night for Veronica to get home from work...  Scarlett is starving for food. Skyler is starving for sex. Guess who eats first?  You'll need a cold shower after watching Dia and Mellanie in the bath!,['Featuring Allie Haze & Brittany Stevens'],['Romance'],70,2009
Rock N Roll Dreams,1,5,"A lonely pretty boy is all alone on Christmas eve on his first day away from home as he gets ready for his Freshman year in College. He gets tipsy on a few drinks and summons up the ghost of Rock legend Gene Vincent, together they spend a romantic sensual evening together as the rock legend makes the lonely boy feel like a million bucks, an evening we can all only dream of. School year finally starts and the teacher on modern social studies tells the class about his days in Berkeley when free love was king and Patrick starts imaging the summer of love and that dorm room his teacher describes with the debaucheries that would be unthinkable today. Times change, and this is what this movie is about. There in class he meets a guitar player on his way to an audition with a producer who our boy has no problem imaging it was the infamous Phil Spector.",['A Sex Fable for the Dreamer in You. Dream on Baby!'],"['Fantasy', 'Comedy', 'Drama']",70,1995
College Sweethearts 6,1,5,They always do their homework together… and always behind locked doors!,['Featuring Ruby Knox & Amber Prossly'],['Romance'],70,2009
My TS Teacher,1,5,"Sweet, shy Sarah is stuck in a troubled relationship with insensitive Dimitri and finds solace in her friendship with intellectual, understanding Professor Rivers. But Dimitri suspects the brilliant professor's interest in Sarah is more than academic, so he confronts the sexy redhead and tries to seduce her. Will a man come between the older and younger women, or is their lesbian love destined to prevail?","[""First she stimulated her young student's mind.. then  her body""]",['Romance'],8,2016
TS Sister In Law,1,5,"When sexy muscle stud Jake gets engaged to gorgeous Jennifer he invites his handsome brother to fly in from Iceland to meet his beautiful bride. Little does he know that the curvy Latin goddess will feel an immediate attraction for his sensitive, soft spoken brother - maybe because Jake is busy fighting his own attraction for Jennifer's best friend, elegant Shayla.",['When Forbidden Lust Is Thicker Than Blood'],['Romance'],8,2015
XConfessions 6,1,5,"In these 10 brand new films you'll see: a cunnilingus master in a fun artsy film, the sensual powers of wine, the chronicles of a moaning neighbor, self-pleasure watched through a Go-Pro camera, an undying desire for big breasts, a striptease on Finnish tango, ass-less chaps dancing to lust, an incredibly hot BDSM story, the kinkiest threesome, and the first anal sex scene ever at XConfessions. Included: Be a Hero; The Ultimate Kink; Try My Boyfriend; Wine is the Best Lubricant; My Moaning Neighbor; His Was First in My Ass; Titty Titty Bang Bang; Chicazo; Dominate Me; Magic Magnus.",['10 anonymous sex confessions turned into explicit short films.'],['Drama'],62,2016
Oriental Hawaii,1,5,"A couple, their two daughters and two sons go on a vacation. The daughters decide to explore each other, two Asian beauties offer to service everyone and dad has a dream about family orgy which disturbs him much more than it does mom.","['A sensual tidal wave', 'Mai Lin goes... Oriental Hawaii']",['Comedy'],70,1982
Level-C,1,14,Mizuki is a male fashion model with a nice apartment. Kazuomi just had his girlfriend kick him out. Kazuomi sets out to find someone new to live with and sees Mizuki on the street. Kazuomi thinks Mizuki is cute and asks to stay with him in exchange for great sex. Mizuki thinks he is joking until they are at his apartment later that night and Kazuomi makes good on his promise.,"['Be they big and burly', 'or skinny and sweet. Boys will be with boys.']","['Animation', 'Romance']",40,1995
Lesbian Love Stories 6,1,5,"Looking for true love! When Casey Calvert suspects her husband, Bill, of cheating on her, she'll go to no small sacrifice to catch him in the act. Casey deploys bombshell Belle Noire to seduce Bill, but ends up falling in love with Belle in the process! Belle has a girlfriend already, but Casey is hopelessly in love with her and ready to end her failed marriage so they can be together. Will Casey leave her husband, and will Belle and Casey end up together? Find out in the sixth installment of Lesbian Love Stories.",['Infidelity'],['Romance'],70,2015
Secret Lesbian Diaries 4,1,5,"Secret Lesbian Diaries returns with an exciting fourth installment starring Carmen Callaway, Bonnie Rotten, Dillion Harper, Jessica Ryan, and more. It's Carmen's first day at college and she already has a crush on her new roommate Roxxi. Unfortunately for Carmen, Roxxi is already in a relationship. With her diary in hand, Carmen enacts a plan to trick Roxxi into breaking up with her girlfriend so that Carmen can have her new sexy roommate all to herself! Meanwhile, Dillion is sent to live at her cousin Bonnie's house. She hates being away from home until she meets Natalia, Bonnie's beautiful, world-traveling friend. These secrets bring a lot of drama, and even hotter sex!",['Secrets are meant to be kept. Secrets bring lots of drama!'],['Romance'],70,2016
Her First Older Woman 5,1,5,"""She taught me ways of enjoying my body that I never even dreamed of!""",['Featuring Nina Hartley & Izabella Star'],['Romance'],70,2009
She's My Man 7,1,5,"She can do almost anything he can do, but I'll still like this one in the morning!",['Featuring: Alyssa Dutch & Kendra Kaine'],['Romance'],70,2010
Sisterly Love 2,1,5,"Casey finds herself unable to resist her stepsister, Shyla's advances in the aftermath of their steamy one night stand. Vulnerable and disappointed after losing out on a coveted modeling contract, Ryan seeks comfort in the arms of her seductive stepsister. Karla's burning desire for her stepsister, Scarlet explodes when she realizes that their feelings for one another are mutual. After discovering her stepsister's deviant side, Sabrina realizes that when it comes to sex, she might not know everything.","['When it Comes to Family', ""There's Nothing Like Sisterly Love.""]",['Romance'],70,2015
To Steal a Kiss,1,5,"Temperatures are rising in this small town and Kylie Ireland is turning up the heat! Bored and frustrated, this red-headed honey creates her own excitement with labe-lovin girlfriends Adrianna Sage and Zana. Cheating husbands, outdoor sex, an anal rendezvous, and a mysterious stranger gets everyone's panties wet! They're stealing more than kisses in these ball-draining blockbuster!",['Their Lips Will Never Be the Same!'],['Action'],70,2001
The Exhibitionist,1,5,"When a sexy young woman moves in next door, a dark secret awakens in Wyatt Chamberfield. He likes to watch. And one night, seeing her bring a young man home, he's mesmerized watching them make love through the bedroom window. The next morning, the young woman confronts him, but she's not angry or upset. She likes being watched, and their deviant relationship takes a dark turn.",['Flirting with shame.'],"['Drama', 'Romance']",8,2013
The Stripper,1,5,"Charlie plans to make an honest woman out of his girlfriend, May, a former stripper. But when times get tight and stress levels heighten, people let their emotions get the best of them. Charlie's thing for strippers risks returning, while Mary has some former clients who are always ready to let her be her true self.",['Be careful of the naked truth!'],"['Drama', 'Romance']",8,2013
The Stripper 2,1,5,"When his headline-stripper, who also happens to be his wife, has an emotional meltdown, a strip club owner looks to a very attractive, up-and-coming exotic dancer to take her place. Friction soon develops between the two girls as they vie for the top spot at the club, and the owner's attention.","[""Underneath we're all the same...""]",['Drama'],8,2013
One Way at a Time,1,5,"A mother leaves for her office job where she gets in plenty of  play as well as work.  Meanwhile, her two daughters hop on their mopeds in search of action. They find it.",['One Way at a Time... Because Variety is the Spice of Love!'],['Comedy'],70,1979
Sinful Sis,1,14,"Honoka arrived at home with snacks, juice, and candies which are her brothers, named Hirokazu, favorite stuff. However, she noticed there has been an unexpected guest - Akasaki. She attends the same class as Hirokazu and for that matter he invited her for a study session and Honoka misunderstood her as his girlfriend. Will Hirokazu make up with his sister in a secret way while Akasaki is still in their house?",['A Girl Is In Your House'],['Animation'],40,2014
Nylon Zone,1,5,"Tom is suffering from writer's block. He goes to a resort to help with his flow only to be ""seduced"" by a sexy Asian temptress (Mia Smiles) who appears in his dreams and fantasies. Watch Mia tease him in her short dress, shiny sheer-to-waist suntan pantyhose with no cotton panel and clear/black platform slides! Then she strips out of her pantyhose tries on a black fishnet body suit and teases him some more. Was it all a dream? You decide!",['Take a journey through the Nylon Zone!'],['Fantasy'],70,2002
Porn-o-Matic 2001,1,5,Porn-O-Matic 2001: There's a new model in town...  ... and this one'll cook a weenie in no time!,"[""... and this one'll cook a weenie in no time!""]",['Romance'],70,2001
Untamed Heart,1,5,A woman throws caution to the winds and runs off with a bad boy biker to have a fantasy-filled adventure with an unexpected twist.,"[""It's the hardest decision of her life: will she play it safe or will she follow her heart?""]",['Romance'],70,2014
Little Orphan Dusty,1,5,"Dusty is a runaway teenage girl who gets attacked and gang-raped by a group of savage motorcyclists. She gets taken into the household of a sympathetic artist named Frankie whom she falls in love with, but has problems adjusting to his artistic and social lifestyle.",['Have you ever been in love Frankie? Hell Bent For Hot Sex.  A Film Dedicated to Lovers and Losers'],"['Crime', 'Drama', 'Romance']",70,1978
Amber's Balloon Antics,1,5,Amber pops lots of balloons,"[""She just won't make the balloons explode"", 'she will make you pop too!']",['Fantasy'],70,2001
Young Girl Seductions 5,1,5,"Get ready for 5 stimulating scenes of high definition erotica with these fresh young cuties! Samantha Rone, Sabrina Banks, Chloe Amour, Harley Dean, and Brooke Wylde have for their panties all wet, and they can't wait to get satisfied. These flirty young girls are just begging for your attention!",['5 Young Flirts In 5 Scenes'],['Romance'],70,2015
Hoxton Honey,1,5,"Porno films never seem to have trendy people in them. Where are the sexy model types you see in fashion magazines? Anna Span, Britains first female porn director, decided to hang out in Londons trendy Hoxton area to catch the beautiful people going at it like animals in their own stylish pads.",['Genuine Female Point of View'],['Comedy'],69,2005
Intercourse with the Vampire,1,5,"Porn parody of 'Interview with the Vampire'.  Forever Yours Imagine what it would be like to be alive forever. To never grow old. . . to be forever young, forever hard, forever ready. To have a life full of unimaginable erotic sensations. . . to have any woman you want, whenever you want her, in any way you please. To make love to an endless array of beautiful, willing women forever and ever. Is it a dream? A fantasy? It's all this and more. . . he's here.",['Forever Young Forever Yours'],"['Comedy', 'Drama']",70,1994
Lesbian Seductions: Older/Younger 31,1,5,The revealing twisted road from desire to pursuit and surrender. Three hours of passionate seduction and intense orgasms! These older women seduce these younger women into pure sexual bliss!  This movie is the most realistic sex in a lesbian adult movie. There is nothing better than to see girlfriends pleasure each other no matter if there is an age difference. These women are very horny and sexual! Enjoy four scenes of action!,['Their only sin is unconventional love.'],['Romance'],70,2010
Underworld,1,5,"Award winning director Michael Raven (best film AVN Awards 2001) weaves a classic tale of lost love, dark desires and endless evil as only Raven can, from a pulse pounding sexual rollercoaster ride into the heart of hell to the sex filled dens of the souless, raven shows a world on sin unlike anything ever imagined, peopled with wild beauties, tireless studs, all captives in a landscape of sheer decadence.",['Lust Never Dies'],['Action'],70,2001
Bad Girls 8: Prisoners of Love,1,5,"Kobe and Billy, both fresh meat at Cellblock Number Nine fall in love. There's only one problem. Kobe's a con and Billy's a guard. And nothing conjugal supposed to come between them. Except in adult. Join Ralph Parfait, jail-porn's premiere director, in Part Eight of the best series behind bars : Bad Girls. This time starring the hottest Asian in film, Kobe Tai, in a performance that'll have you climbing the walls-into jail, that is. Enjoy your time. We'll put the file in the cake.",['Kobe Tai is passed around like currency'],['Drama'],70,1997
King Dong,1,5,"A spoof of King Kong, King Dong (or Lost on Adventure Island). A young woman runs away from home and sets off to sea with her 3 friends. Everything is fine until a battleship collides with their sailboat and leaves a young couple washed up on a prehistoric island with ferocious dinosaurs and the giant  King Dong.",['No Man Was Enough For Her'],"['Fantasy', 'Horror', 'Science Fiction']",70,1984
Maximum Minka,1,5,"Whether you are a recent fan of the amazing Minka or you've been an admirer since her debut for us in the October 1994 SCORE magazine, this DVD is the definitive guide to the story of the world's #1 Asian tit-princess. Her fantasy-boobs measuring a staggering 56 inches on top and straining the straps of her 44KK brassieres, Korean-born Minka has remained a huge breast-man favorite for 16 years as a big-bust model, magazine covergirl, hardcore porn star, showgirl, ring girl and exotic dancer. Personally hosted by Minka throughout, Maximum Minka tells her incredible story from her early days to the present.",['Documentary on the legendary Minka'],['Documentary'],70,2011
Unfaithful,1,5,"After losing his job, Emily's husband Andy is depressed and is taking it out on her. She decides that a weekend apart is what is needed, but while away, Emily meets a handsome stranger and things go too far! Filled with guilt about her infidelity, she returns home and is greeted by a joyful, and newly employed, Andy! Emily's content to keep the affair a secret but unfortunately, the once charming stranger has other plans. If there are consequences for being unfaithful...who will pay the price?",['Love lost & found!'],['Drama'],70,2012
"Benett, Lewis",1,5,"Description: When the pretty maid with the tight butt found his mother's dildo while cleaning, Mike knew his chance as pounding that asshole of hers was now. She was scared and thought she would lose her job so she submitted to him by letting him play with her nasty little asshole. She knew he was going to fuck her bunghole because she found ass stuffing magazines in his room while cleaning up. Mike wasted no time getting her to bend over and take her just punishment of a juicy tight asshole fucking.","['Benett', 'Lewis']",['Animation'],70,2017
The Health Spa,1,5,"The reporters June Winters and Alice investigate a health spa that employs ""sexercise."" Alas, their boss Mr. Martin reconsiders after being photographed having sex with the worker Nina who forced herself on him.","[""There's more than exercising going on at this spa.""]",['Drama'],70,1978
The Erotic Dr. Jekyll,1,5,"Charles Jekyll and his naggy wife Linda move into Charles' deceased grandfather's old house where Charles finds a hidden lab, a hunchback and a special magic love potion that makes him irresistible to women.",['The sexual quick change artist'],"['Science Fiction', 'Comedy']",70,1975
Habits of the Heart,1,5,"Strange how things come full circle. Years before, in their small Kansas hometown, they unraveled the mysteries of love and lust together. He left to be a pilot, and she took off for the spotlights of Hollywood. Years later, a cabbie picks up a late night fare in Bel-Air, and they meet once again. Their separate paths have led each of them to this point. In a way, they both got what they wanted; he pilots a cab, and she spends all her time acting happy.","['Cheaters never prosper', 'but they do get a nice long ride!']",['Romance'],70,1998
Out for Blood,1,5,"Due to a witch's spell, a half-human / half-vampire can only become fully human if she finds true love.",['Going down for the count?'],"['Horror', 'Comedy']",70,1990
Show No Mercy,1,5,"The evil Lord Zuru in his ever-longing quest to rule the galaxy attempts to control the 5 sex-crazed muses of Ciria. By doing so, Zuru's plan to fuse their powers and create one master power creates an intergalactic hardcore frenzy - that's guaranteed to satisfy the wildest of perversions, in this…the ultimate Cosplay Adventure!",['Wicked Cosplay... Show no Mercy'],['Comedy'],70,2013
Dear Pam,1,5,"The Decency and Morality League is about to award advice columnist Pam Slanders their coveted ""Most Moral Woman of the Year"" award. She tells them about her toughest ""case;"" a man whose stepdaughter, secretary and other women trouble him.","['Got a Problem? Ask Pam Slanders', ""America's Sexiest Advice Columnist. But Remember"", 'Do As She Says Not As She Does!']",['Comedy'],70,1976
Jezebel,1,5,"Throughout history one name, by its very mention, has been able to not only strike fear but also electrify man's sexual desire. Songs have been written about her, books recount her cunning. Her name, of course is Jezebel. Able to lure men and women into her evil web of passion, Jezebel intoxicates with her beauty, destroys with her guile. And so it is with our modern day enchantress. Things were not always this way...the transformation came about through a mysterious figure that suddenly appears before her in a spectacular flash of light & color. He promises to fulfill her every sexual fantasy & experience every erotic pleasure known to man. However, she must pay the price for causing such anguish!",['A Hungry Female with a Carnal Appetite'],"['Drama', 'Fantasy']",70,1979
